{
  "as_of": "2026-09-07",
  "authoring_status": "MODEL_AUTHORED_SOURCE_GUIDED_NOT_EXPERT_VALIDATED",
  "history": [],
  "scenario_group_id": "failed_mandatory_spec",
  "scenario_id": "D019",
  "split": "dev",
  "suite": "multi_evidence",
  "synthetic": true,
  "topic": "direct_award",
  "user_message": "Assume an English public contracting authority and an above-threshold, non-exempt contract, not a utility, concession, defence or light-touch contract, unless the facts below expressly say otherwise.\n\nAn open competition for specialist equipment produced bids that all failed an essential technical requirement. We have not established whether a different competitive approach could work. The authority wants to negotiate with one former bidder and sign this week.\n\nWhat must be established before switching route, what supplier checks remain, and what publication is needed before award?"
}
